{
  "abilityId": "warrior_ultimate",
  "role": "warrior",
  "focusCost": 0,
  "grooveCost": 100,
  "phraseLengthBars": 2,
  "inputPattern": ["tap", "tap", "tap", "tap", "tap", "tap", "tap", "tap"],
  "timingTemplate": ["1.1", "1.2", "1.3", "1.4", "2.1", "2.2", "2.3", "2.4"],
  "effects": [{ "type": "damage", "value": 90 }]
}
