{
  "abilityId": "healer_sightread",
  "role": "healer",
  "focusCost": 2,
  "phraseLengthBars": 1,
  "inputPattern": ["tap", "tap", "hold"],
  "timingTemplate": ["1.1", "1.3", "1.4"],
  "effects": [
    { "type": "forecastReveal", "bars": 2 },
    { "type": "partyBuff", "stat": "accuracy", "value": 0.1, "durationRounds": 2 }
  ]
}
