{
  "abilityId": "mage_static_field",
  "role": "mage",
  "focusCost": 2,
  "phraseLengthBars": 1,
  "inputPattern": ["tap", "tap", "tap"],
  "timingTemplate": ["1.2", "1.3", "1.4"],
  "effects": [
    { "type": "damage", "value": 10 },
    { "type": "debuff", "stat": "speed", "value": -0.1, "durationRounds": 1 }
  ]
}
